{
  "name": "no observer is told what a frame carried, by any path",
  "layer": "peer",
  "protocol": {
    "revision": "bitwire/1",
    "normativeDigest": "7797682b0f05f86c508eafbd3be23c2084acd2f5cfc766922f9372b652dc416e"
  },
  "scope": "core",
  "optional": "observer",
  "source": {
    "path": "protocol/bitwire-1/source/conformance/scenarios/peer/no-payload-reaches-an-observer.json",
    "sha256": "cd86ce19f6b872c24e2be85028b78561f764aca20da68dfb0395d40b98bcd66c"
  },
  "replaces": "runtime/go/observer_test.go TestAnObserverIsToldNoPayload and its TypeScript twin",
  "needs": [
    "observer",
    "peer"
  ],
  "steps": [
    {
      "on": "runner",
      "op": "pair.peers",
      "args": {
        "server": "a",
        "server_options": {
          "observe": true
        },
        "client_options": {
          "observe": true
        }
      },
      "bind": {
        "server": "pa",
        "client": "pb"
      }
    },
    {
      "on": "a",
      "op": "peer.handle",
      "args": {
        "on": "$pa",
        "method": "echo",
        "behavior": {
          "kind": "echo"
        }
      }
    },
    {
      "on": "a",
      "op": "peer.handle",
      "args": {
        "on": "$pa",
        "method": "deny",
        "behavior": {
          "kind": "fail",
          "code": "denied",
          "message": "no: sentinel-4bf92f35-payload",
          "data": {
            "why": "sentinel-4bf92f35-payload"
          }
        }
      }
    },
    {
      "on": "a",
      "op": "peer.handle",
      "args": {
        "on": "$pa",
        "method": "give-up",
        "behavior": {
          "kind": "panic",
          "value": "the handler gave up"
        }
      },
      "note": "a panic's value is the handler's own words and is reported; what the frame carried, in params, is not"
    },
    {
      "on": "b",
      "op": "peer.call",
      "args": {
        "on": "$pb",
        "method": "echo",
        "params": {
          "text": "sentinel-4bf92f35-payload"
        }
      },
      "bind": "c1"
    },
    {
      "on": "b",
      "op": "call.await",
      "args": {
        "on": "$c1"
      },
      "expect": {
        "result": {
          "text": "sentinel-4bf92f35-payload"
        }
      }
    },
    {
      "on": "b",
      "op": "peer.call",
      "args": {
        "on": "$pb",
        "method": "deny",
        "params": {}
      },
      "bind": "c2"
    },
    {
      "on": "b",
      "op": "call.await",
      "args": {
        "on": "$c2"
      },
      "expect": {
        "error": {
          "code": "denied"
        }
      }
    },
    {
      "on": "b",
      "op": "peer.call",
      "args": {
        "on": "$pb",
        "method": "give-up",
        "params": {
          "text": "sentinel-4bf92f35-payload"
        }
      },
      "bind": "c3"
    },
    {
      "on": "b",
      "op": "call.await",
      "args": {
        "on": "$c3"
      },
      "expect": {
        "error": {
          "code": "internal"
        }
      }
    },
    {
      "on": "b",
      "op": "peer.emit",
      "args": {
        "on": "$pb",
        "event": "told",
        "data": {
          "text": "sentinel-4bf92f35-payload"
        }
      }
    },
    {
      "on": "a",
      "op": "peer.await_event",
      "args": {
        "on": "$pa",
        "name": "told"
      }
    },
    {
      "on": "a",
      "op": "peer.observed",
      "args": {
        "on": "$pa"
      },
      "expect": {
        "$contains": [
          {
            "type": "request.ended",
            "method": "deny",
            "outcome": "error",
            "error_code": "denied"
          },
          {
            "type": "handler.panic",
            "method": "give-up"
          },
          {
            "type": "event.delivered",
            "name": "told"
          }
        ]
      },
      "assert": {
        "absent": "sentinel-4bf92f35"
      },
      "note": "the paths were exercised — an error with data, a panic with a value, an event with data — and none of it reached the observer"
    },
    {
      "on": "b",
      "op": "peer.observed",
      "args": {
        "on": "$pb"
      },
      "expect": {
        "$contains": [
          {
            "type": "request.ended",
            "method": "echo",
            "outcome": "ok"
          },
          {
            "type": "request.ended",
            "method": "deny",
            "outcome": "error",
            "error_code": "denied"
          }
        ]
      },
      "assert": {
        "absent": "sentinel-4bf92f35"
      }
    }
  ]
}
