{
  "name": "a channel is a connection: frames arrive in order and whole, text and binary alike, and a close carries its code and reason to the other side",
  "layer": "tunnel",
  "protocol": {
    "revision": "bitwire/1",
    "normativeDigest": "7797682b0f05f86c508eafbd3be23c2084acd2f5cfc766922f9372b652dc416e"
  },
  "scope": "tunnel",
  "source": {
    "path": "protocol/bitwire-1/source/conformance/scenarios/tunnel/frames-over-a-channel.json",
    "sha256": "05570e18ad4014f97b6c33f2725b41a1c0e5167ef1260a5c20781d86c670ab6a"
  },
  "needs": [
    "peer",
    "seam",
    "tunnel"
  ],
  "steps": [
    {
      "on": "runner",
      "op": "pair.peers",
      "args": {
        "server": "a"
      },
      "bind": {
        "server": "pa",
        "client": "pb"
      }
    },
    {
      "on": "a",
      "op": "tunnel.over",
      "args": {
        "on": "$pa"
      },
      "bind": "ta"
    },
    {
      "on": "b",
      "op": "tunnel.over",
      "args": {
        "on": "$pb"
      },
      "bind": "tb"
    },
    {
      "on": "b",
      "op": "tunnel.open",
      "args": {
        "on": "$tb",
        "family": "probe",
        "consume": "eager"
      },
      "bind": {
        "handle": "cb",
        "id": "id"
      }
    },
    {
      "on": "a",
      "op": "tunnel.accept",
      "args": {
        "on": "$ta",
        "consume": "eager"
      },
      "bind": {
        "handle": "ca"
      }
    },
    {
      "on": "b",
      "op": "conn.send",
      "args": {
        "on": "$cb",
        "kind": "text",
        "text": "one"
      }
    },
    {
      "on": "b",
      "op": "conn.send",
      "args": {
        "on": "$cb",
        "kind": "binary",
        "base64": "AAEC"
      }
    },
    {
      "on": "a",
      "op": "conn.receive",
      "args": {
        "on": "$ca"
      },
      "expect": {
        "kind": "text",
        "text": "one"
      }
    },
    {
      "on": "a",
      "op": "conn.receive",
      "args": {
        "on": "$ca"
      },
      "expect": {
        "kind": "binary",
        "base64": "AAEC"
      }
    },
    {
      "on": "a",
      "op": "conn.send",
      "args": {
        "on": "$ca",
        "kind": "text",
        "text": "two"
      }
    },
    {
      "on": "b",
      "op": "conn.receive",
      "args": {
        "on": "$cb"
      },
      "expect": {
        "kind": "text",
        "text": "two"
      }
    },
    {
      "on": "b",
      "op": "conn.close",
      "args": {
        "on": "$cb",
        "code": 4001,
        "reason": "the opener is done"
      }
    },
    {
      "on": "a",
      "op": "conn.receive",
      "args": {
        "on": "$ca"
      },
      "expect_error": {
        "code": "closed",
        "close_code": 4001,
        "reason": "the opener is done"
      }
    }
  ]
}
